,ref,doi,pub_link,doi_short,meta,indigenous,local,knowledge
365,"O'Reilly, C.M., S.R. Alin, P.D. Plisnier, A.S. Cohen, and B.A. McKee, 2003: Climate change decreases aquatic ecosystem productivity of Lake Tanganyika, Africa. Nature, 424(6950), 766-768.",https://doi.org/10.1038/nature01833,https://www.nature.com/articles/nature01833,10.1038/nature01833,Publisher link; Couldn't analyze abstract,,,
366,"Obidzinski, K., R. Andriani, H. Komanidin, and A. Andrianto, 2012: Environmental and social impacts of oil palm plantations and their implications for biofuel production in Indonesia. Ecology and Society, 17(1), 25, www.ecologyand society.org/vol17/iss1/art25/.",https://doi.org/10.5751/ES-04775-170125,https://www.ecologyandsociety.org/vol17/iss1/art25/,10.5751/ES-04775-170125,Publisher link; Couldn't analyze abstract,,,
367,"OECD, 2011: Divided We Stand: Why Inequality Keeps Rising. Organisation for Economic Co-operation and Development (OECD), Paris, France, 388 pp.",,,,,,,
368,"Olsen, K.H., 2007: The clean development mechanism's contribution to sustainable development: a review of the literature. Climatic Change, 84(1), 59-73.",https://doi.org/10.1007/s10584-007-9267-y,https://link.springer.com/article/10.1007/s10584-007-9267-y,10.1007/s10584-007-9267-y,Publisher link; Analyzed abstract; Exported the abstract,0,0,1
369,"Onta, N. and B.P. Resurreccion, 2011: The Role of gender and caste in climate adap- tation strategies in Nepal. Mountain Research and Development, 31(4), 351- 356.",https://doi.org/10.1659/MRD-JOURNAL-D-10-00085.1,https://bioone.org/journals/mountain-research-and-development/volume-31/issue-4/MRD-JOURNAL-D-10-00085.1/The-Role-of-Gender-and-Caste-in-Climate-Adaptation-Strategies/10.1659/MRD-JOURNAL-D-10-00085.1.full,10.1659/MRD-JOURNAL-D-10-00085.1,Publisher link,,,
370,"Orlove, B., 2009: The past, the present and some possible futures of adaptation. In: Adapting to Climate Change: Thresholds, Values, Governance [Adger, N., I. Lorenzoni, and K. O'Brien (eds.)]. Cambridge University Press, Cambridge, UK, pp. 131-163.",https://doi.org/10.1017/CBO9780511596667.010,https://www.cambridge.org/core/books/abs/adapting-to-climate-change/past-the-present-and-some-possible-futures-of-adaptation/1E409FCDD16FD961DFF3F492495B0DA0,10.1017/CBO9780511596667.010,Publisher link,,,
371,"Orr, Y., R. Schimmer, R. Geerken, A. Castro, D. Taylor, and D. Brokensha, 2012: Ethno- ecology in the shadow of rain and the light of experience: local perceptions of drought and climate change in east Sumba, Indonesia. In: Climate Change and Threatened Communities [Castro, A.P., D. Taylor, and D.W. Brokensha (eds.)]. Practical Action Publishing, Rugby, UK, pp. 175-184.",https://doi.org/10.3362/9781780447254.015,https://practicalactionpublishing.com,10.3362/9781780447254.015,Publisher link,,,
372,"Ortiz, I. and M. Cummins, 2011: Global Inequality: Beyond the Bottom Billion: A Rapid Review of Income Distribution in 141 Countries. UNICEF Social and Economic Policy Working Paper, United Nations International Emergency Children's Fund (UNICEF), New York, NY, USA, 65 pp.",https://doi.org/10.2139/ssrn.1805046,http://www.ssrn.com/abstract=1805046,10.2139/ssrn.1805046,Publisher link; Couldn't analyze abstract,,,
373,"Ortiz, I. and M. Cummins, 2013: The Age of Austerity: A Review of Public Expenditures and Adjustment Measures in 181 Countries. Working Paper March 2013, Initiative for Policy Dialogue, New York, NY, USA and the South Centre, Geneva, Switzerland, 55 pp.",https://doi.org/10.2139/ssrn.2260771,http://www.ssrn.com/abstract=2260771,10.2139/ssrn.2260771,Publisher link; Couldn't analyze abstract,,,
374,"Osbahr, H., C. Twyman, W. Neil Adger, and D.S.G. Thomas, 2008: Effective livelihood adaptation to climate change disturbance: scale dimensions of practice in Mozambique. Geoforum, 39(6), 1951-1964.",https://doi.org/10.1016/j.geoforum.2008.07.010,https://linkinghub.elsevier.com/retrieve/pii/S0016718508001000,10.1016/j.geoforum.2008.07.010,Publisher link; Analyzed abstract; Exported the abstract,0,1,0
375,"Osbahr, H., C. Twyman, W.N. Adger, and D.S.G. Thomas, 2010: Evaluating successful livelihood adaptation to climate variability and change in southern Africa. Ecology and Society, 15(2), 27, www.ecologyandsociety.org/vol15/iss2/art27/.",https://doi.org/10.5751/ES-03388-150227,https://www.ecologyandsociety.org/vol15/iss2/art27/,10.5751/ES-03388-150227,Publisher link; Couldn't analyze abstract,,,
376,"Ostfeld, R.S., 2009: Climate change and the distribution and intensity of infectious diseases. Ecology, 90(4), 903-905.",https://doi.org/10.1890/08-0659.1,https://onlinelibrary.wiley.com/resolve/doi?DOI=10.1890/08-0659.1,10.1890/08-0659.1,Publisher link; Couldn't analyze abstract,,,
377,"Ostrom, E., 2010: Polycentric systems for coping with collective action and global environmental change. Global Environmental Change, 20(4), 550-557.",https://doi.org/10.1016/j.gloenvcha.2010.07.004,https://linkinghub.elsevier.com/retrieve/pii/S0959378010000634,10.1016/j.gloenvcha.2010.07.004,Publisher link; Analyzed abstract; Exported the abstract,0,1,0
378,"P. Rowhani, 2011: Climate volatility and poverty vulnerability in Tanzania.",,,,,,,
379,"Paavola, J. and W.N. Adger, 2006: Fair adaptation to climate change. Ecological Economics, 56(4), 594-609.",https://doi.org/10.1016/j.ecolecon.2005.03.015,https://linkinghub.elsevier.com/retrieve/pii/S0921800905001187,10.1016/j.ecolecon.2005.03.015,Publisher link; Analyzed abstract; Exported the abstract,0,0,0
380,"Paavola, J., 2008: Livelihoods, vulnerability and adaptation to climate change in Morogoro, Tanzania. Environmental Science & Policy, 11(7), 642-654.",https://doi.org/10.1016/j.envsci.2008.06.002,https://linkinghub.elsevier.com/retrieve/pii/S1462901108000695,10.1016/j.envsci.2008.06.002,Publisher link; Analyzed abstract; Exported the abstract,0,0,0
381,"Pagán Motta, M., 2013: Detecting Vulnerable Groups in DHHS ASPR's EMR Data during Response: A Snapshot of Superstorm Sandy. Proceedings of 141st APHA Annual Meeting, November 2-6, 2013, Boston, MA, USA, apha.confex.com/ apha/141am/webprogramadapt/Paper282601.html.",,,,,,,
382,"Parikh, P., S. Chaturvedi, and G. George, 2012: Empowering change: the effects of energy provision on individual aspirations in slum communities. Energy Policy, November 2012, 50, 477-485.",https://doi.org/10.1016/j.enpol.2012.07.046,https://linkinghub.elsevier.com/retrieve/pii/S0301421512006404,10.1016/j.enpol.2012.07.046,Publisher link; Analyzed abstract; Exported the abstract,0,0,0
383,"Parkinson, D., C. Lancaster, and A. Stewart, 2011: A numbers game: lack of gendered data impedes prevention of disaster-related family violence. Health Promotion Journal of Australia, 22, 42-45.",https://doi.org/10.1071/HE11442,https://onlinelibrary.wiley.com/resolve/doi?DOI=10.1071/HE11442,10.1071/HE11442,Publisher link; Couldn't analyze abstract,,,
384,"Parks, B.C. and J.T. Roberts, 2010: Climate change, social theory and justice. Theory, Culture & Society, 27(2-3), 134-166.",https://doi.org/10.1177/0263276409359018,https://journals.sagepub.com/doi/10.1177/0263276409359018,10.1177/0263276409359018,Publisher link; Analyzed abstract; Exported the abstract,0,0,0
385,"Patricola, C.M. and K.H. Cook, 2010: Northern African climate at the end of the twenty-first century: an integrated application of regional and global climate models. Climate Dynamics, 35(1), 193-212.",https://doi.org/10.1007/s00382-009-0623-7,https://link.springer.com/article/10.1007/s00382-009-0623-7,10.1007/s00382-009-0623-7,Publisher link; Analyzed abstract; Exported the abstract,0,0,0
386,"Patt, A., P. Suarez, and U. Hess, 2010: How do small-holder farmers understand insurance, and how much do they want it? Evidence from Africa. Global Environmental Change, 20(1), 153-161.",https://doi.org/10.1016/j.gloenvcha.2009.10.007,https://linkinghub.elsevier.com/retrieve/pii/S0959378009000922,10.1016/j.gloenvcha.2009.10.007,Publisher link; Analyzed abstract; Exported the abstract,0,0,0
387,"Patz, J.A., D. Campbell-Lendrum, T. Holloway, and J.A. Foley, 2005: Impact of regional climate change on human health. Nature, 438, 310-317.",https://doi.org/10.1038/nature04188,https://www.nature.com/articles/nature04188,10.1038/nature04188,Publisher link; Couldn't analyze abstract,,,
388,"Peach Brown, H., 2011: Gender, climate change and REDD+ in the Congo Basin forests of Central Africa. International Forestry Review, 13(2), 163-176.",https://doi.org/10.1505/146554811797406651,https://www.ingentaconnect.com/content/cfa/ifr/2011/00000013/00000002/art00005;jsessionid=15cgbfeh0uw3u.x-ic-live-01,10.1505/146554811797406651,Publisher link; Couldn't analyze abstract,,,
389,"Pelling, M., 2010: Adaptation to Climate Change: From Resilience to Transformation.",https://doi.org/10.4324/9780203889046,https://www.taylorfrancis.com/books/mono/10.4324/9780203889046/adaptation-climate-change-mark-pelling,10.4324/9780203889046,Publisher link,,,
390,"Peralta, A., 2008: Gender and Climate Change Finance: A Case Study from the Philippines. The Women's Environment and Development Organization (WEDO), New York, NY, USA, 19 pp.",,,,,,,
391,"Peraza, S., C. Wesseling, A. Aragon, R. Leiva, R.A. García-Trabanino, C. Torres, K. Jakobsson, C.G. Elinder, and C. Hogstedt, 2012: Decreased kidney function among agricultural workers in El Salvador. American Journal of Kidney Diseases, 59(4), 531-540.",https://doi.org/10.1053/j.ajkd.2011.11.039,https://linkinghub.elsevier.com/retrieve/pii/S0272638611017859,10.1053/j.ajkd.2011.11.039,Publisher link; Analyzed abstract; Exported the abstract,0,0,0
392,"Perch, L. and R. Roy, 2010: Social Policy in the Post-Crisis Context of Small Island Developing States: A Synthesis. United Nations Development Programme (UNDP) and International Policy Centre for Inclusive Growth (IPC-IG), Brasilia, IPC-IG, Brasilia, Brazil, 56 pp.",,,,,,,
393,"Perch, L., 2011: Mitigation of What and by What? Adaptation by Whom and for Whom? Dilemmas in Delivering for the Poor and the Vulnerable in International Climate Policy. Working Paper 79, United Nations Development Programme (UNDP) and International Policy Centre for Inclusive Growth (IPC-IG), IPC-IG, Brasilia, Brazil, 51 pp.",,,,,,,
394,"Perch, L., C. Watson, and B. Barry, 2012: Resource Inequality: Moving Inequalities from the Periphery to the Centre of the Post-2015 Agenda. Background Paper for ""Addressing Inequalities"" Global Thematic Consultation, published online by the Addressing Inequalities Networked Alliance (AINA), a joint Civil Society/UN consultation, co-led by the United Nations International Emergency Children's Fund (UNICEF) and the United Nations Entity for Gender Equality and the Empowerment of Women (UN WOMEN) with support from the Governments of Denmark and Ghana, UNICEF, New York, NY, USA, 25 pp.",,,,,,,
395,"Pereira, R.B. and R. Pereira, 2008: Population health needs beyond ratifying the Kyoto Protocol: occupational deprivation. Rural and Remote Health, 8(927), 1-5.",https://doi.org/10.22605/RRH927,https://www.rrh.org.au/journal/article/927,10.22605/RRH927,Publisher link; Couldn't analyze abstract,,,
396,"Peskett, L., 2007: Biofuels, Agriculture and Poverty Reduction. Natural Resources Perspectives No. 107, Overseas Development Institute (ODI), London, UK, 6 pp. Peters, P.E., 2013: Conflicts over land and threats to customary tenure in Africa.",,,,,,,
397,"Peters-Stanley, M. and K. Hamilton, 2012: Developing Dimension: State of the Voluntary Carbon Markets 2012. Forest Trends Association, Washington, DC, USA, 110 pp.",,,,,,,
398,"Petheram, L., K. Zander, B. Campbell, C. High, and N. Stacey, 2010: 'Strange changes': indigenous perspectives of climate change and adaptation in NE Arnhem Land (Australia). Global Environmental Change, 20(4), 681-692.",https://doi.org/10.1016/j.gloenvcha.2010.05.002,https://linkinghub.elsevier.com/retrieve/pii/S0959378010000427,10.1016/j.gloenvcha.2010.05.002,Publisher link; Analyzed abstract; Exported the abstract,3,0,0
399,"Petrie, B., 2010: Gender and Climate Change: Regional Report: Executive Summary.",,,,,,,
400,"Phelps, J., E.L. Webb, and A. Agrawal, 2010: Does REDD+ threaten to recentralize forest governance? Science, 328(5976), 312-313.",https://doi.org/10.1126/science.1187774,https://www.science.org/doi/10.1126/science.1187774,10.1126/science.1187774,Publisher link,,,
401,"Piao, S., P. Ciais, Y. Huang, Z. Shen, S. Peng, J. Li, L. Zhou, H. Liu, Y. Ma, and Y. Ding, 2010: The impacts of climate change on water resources and agriculture in China. Nature, 467(7311), 43-51.",https://doi.org/10.1038/nature09364,https://www.nature.com/articles/nature09364,10.1038/nature09364,Publisher link; Couldn't analyze abstract,,,
402,"Pielke Jr, R., G. Prins, S. Rayner, and D. Sarewitz, 2007: Lifting the taboo on adaptation.",https://doi.org/10.1038/445597a,https://www.nature.com/articles/445597a,10.1038/445597a,Publisher link; Couldn't analyze abstract,,,
403,"Pierro, R. and B. Desai, 2008: Climate insurance for the poor: challenges for targeting and participation. IDS Bulletin, 39(4), 123-129.",https://doi.org/10.1111/j.1759-5436.2008.tb00485.x,https://onlinelibrary.wiley.com/resolve/doi?DOI=10.1111/j.1759-5436.2008.tb00485.x,10.1111/j.1759-5436.2008.tb00485.x,Publisher link; Couldn't analyze abstract,,,
404,"Pogge, T.W., 2009: Politics as Usual: What Lies Behind the Pro-Poor Rhetoric. Polity Press, Cambridge, UK and Malden, MA, USA, 224 pp.",,,,,,,
405,"Pokorny, B., I. Scholz, and W. de Jong, 2013: REDD+ for the poor or the poor for REDD+? About the limitations of environmental policies in the Amazon and the potential of achieving environmental goals through pro-poor policies. Ecology and Society, 18(2), 3, www.ecologyandsociety.org/vol18/iss2/art3/.",https://doi.org/10.5751/ES-05458-180203,https://www.ecologyandsociety.org/vol18/iss2/art3/,10.5751/ES-05458-180203,Publisher link; Couldn't analyze abstract,,,
406,"Polain, J.D., H.L. Berry, and J.O. Hoskin, 2011: Rapid change, climate adversity and the next 'big dry': older farmers' mental health. Australian Journal of Rural Health, 19(5), 239-243.",https://doi.org/10.1111/j.1440-1584.2011.01219.x,https://onlinelibrary.wiley.com/doi/10.1111/j.1440-1584.2011.01219.x,10.1111/j.1440-1584.2011.01219.x,Publisher link; Couldn't analyze abstract,,,
407,"Posey, J., 2009: The determinants of vulnerability and adaptive capacity at the municipal level: evidence from floodplain management programs in the United States. Global Environmental Change, 19(4), 482-493.",https://doi.org/10.1016/j.gloenvcha.2009.06.003,https://linkinghub.elsevier.com/retrieve/pii/S0959378009000442,10.1016/j.gloenvcha.2009.06.003,Publisher link; Analyzed abstract; Exported the abstract,0,1,0
408,"Pouliotte, J., B. Smit, and L. Westerhoff, 2009: Adaptation and development: livelihoods and climate change in Subarnabad, Bangladesh. Climate and Development, 1(1), 31-46.",https://doi.org/10.3763/cdev.2009.0001,https://www.tandfonline.com/doi/abs/10.3763/cdev.2009.0001,10.3763/cdev.2009.0001,Publisher link; Analyzed abstract; Exported the abstract,0,0,0
409,"Pradhan, E.K., K.P. West Jr, J. Katz, S.C. LeClerq, S.K. Khatry, and S.R. Shrestha, 2007: Risk of flood-related mortality in Nepal. Disasters, 31(1), 57-70.",https://doi.org/10.1111/j.1467-7717.2007.00340.x,https://onlinelibrary.wiley.com/doi/10.1111/j.1467-7717.2007.00340.x,10.1111/j.1467-7717.2007.00340.x,Publisher link; Couldn't analyze abstract,,,
410,"Proceedings of the National Academy of Sciences of the United States of America, 105(32), 11081-11086.",,,,,,,
411,"Quinn, C.H., G. Ziervogel, A. Taylor, T. Takama, and F. Thomalla, 2011: Coping with multiple stresses in rural South Africa. Ecology and Society, 16(3), 2, www.ecology andsociety.org/vol16/iss3/art2/.",https://doi.org/10.5751/ES-04216-160302,https://www.ecologyandsociety.org/vol16/iss3/art2/,10.5751/ES-04216-160302,Publisher link; Couldn't analyze abstract,,,
412,"Quisumbing, A.R., N. Kumar, and J. Behrman, 2011: Do Shocks Affect Men's and Women's Assets Differently? A Review of Literature and New Evidence from Bangladesh and Uganda. International Food Policy Research Institute (IFPRI), Washington, DC, USA, 48 pp.",,,,,,,
413,"R. Lewis, J.C. Lovett, J. Massao, and Y. Ngaga, 2011: At the heart of REDD+: a role for local people in monitoring forests? Conservation Letters, 4(2), 158- 167.",https://doi.org/10.1111/j.1755-263X.2010.00159.x,https://onlinelibrary.wiley.com/doi/10.1111/j.1755-263X.2010.00159.x,10.1111/j.1755-263X.2010.00159.x,Publisher link; Couldn't analyze abstract,,,
414,"R. Tippman, P. Mann, and K. Brown, 2009: Reforming the CDM for sustainable development: lessons learned and policy futures. Environmental Science & Policy, 12(7), 820-831.",https://doi.org/10.1016/j.envsci.2009.06.007,https://linkinghub.elsevier.com/retrieve/pii/S1462901109000847,10.1016/j.envsci.2009.06.007,Publisher link; Analyzed abstract; Exported the abstract,0,0,0
415,"R.K and A. Reisinger (eds.)]. IPCC, Geneva, Switzerland, pp. 719-743.",,,,,,,
416,"Rahlao, S., B. Mantlana, H. Winkler, and T. Knowles, 2012: South Africa's national REDD+ initiative: assessing the potential of the forestry sector on climate change mitigation. Environmental Science & Policy, 17, 24-32.",https://doi.org/10.1016/j.envsci.2011.11.013,https://linkinghub.elsevier.com/retrieve/pii/S1462901111001900,10.1016/j.envsci.2011.11.013,Publisher link; Analyzed abstract; Exported the abstract,0,0,0
417,"Rahman, M., 2013: Climate change, disaster and gender vulnerability: a study on two divisions of Bangladesh. American Journal of Human Ecology, 2(2), 72-82.",https://doi.org/10.11634/216796221302315,http://worldscholars.org/index.php/ajhe/article/view/0202_5,10.11634/216796221302315,Publisher link; Couldn't analyze abstract,,,
418,"Ravallion, M. and S. Chen, 2012: Monitoring inequality. In: Let's Talk Development. A blog hosted by the World Bank's Chief Economist, submitted on June 20, 2012, The World Bank, Washington, DC, USA, blogs.worldbank.org/ developmenttalk/monitoring-inequality.",,,,,,,
419,"Ray-Bennett, N.S., 2009: Multiple disasters and policy responses in pre-and post- independence Orissa, India. Disasters, 33(2), 274-290.",https://doi.org/10.1111/j.1467-7717.2008.01074.x,https://onlinelibrary.wiley.com/doi/10.1111/j.1467-7717.2008.01074.x,10.1111/j.1467-7717.2008.01074.x,Publisher link; Couldn't analyze abstract,,,
420,"Reason, J., 2000: Human error: models and management. BMJ: British Medical Journal,",https://doi.org/10.1136/bmj.320.7237.768,https://www.bmj.com/content/320/7237/768,10.1136/bmj.320.7237.768,Publisher link; Couldn't analyze abstract,,,
421,"Reed, M.S., G. Podesta, I. Fazey, N. Geeson, R. Hessel, K. Hubacek, D. Letson, D. Nainggolan, C. Prell, and M.G. Rickenbach, 2013: Combining analytical frameworks to assess livelihood vulnerability to climate change and analyse adaptation options. Ecological Economics, 94, 66-77.",https://doi.org/10.1016/j.ecolecon.2013.07.007,https://linkinghub.elsevier.com/retrieve/pii/S0921800913002267,10.1016/j.ecolecon.2013.07.007,Publisher link; Analyzed abstract; Exported the abstract,0,0,0
422,"Reid, P. and C. Vogel, 2006: Living and responding to multiple stressors in South Africa - glimpses from KwaZulu-Natal. Global Environmental Change, 16(2), 195-206.",https://doi.org/10.1016/j.gloenvcha.2006.01.003,https://linkinghub.elsevier.com/retrieve/pii/S095937800600015X,10.1016/j.gloenvcha.2006.01.003,Publisher link; Analyzed abstract; Exported the abstract,0,0,0
423,"Renton, A., 2009: Suffering the Science: Climate Change, People, and Poverty. Oxfam Briefing Paper No. 130, Oxfam International, Boston, MA, USA, 61pp.",,,,,,,
424,"Resurreccion, B.P., 2011: The Gender and Climate Debate: More of the Same or New Pathways of Thinking and Doing? Asia Security Initiative Policy Series, Working Paper No. 10, RSIS Centre for Non-Traditional Security (NTS) Studies, Singapore, 19 pp.",,,,,,,
425,"Ribot, J., 2010: Vulnerability does not fall from the sky: toward multiscale, pro-poor climate policy. In: Social Dimensions of Climate Change: Equity and Vulnerability in a Warming World [Mearns, R. and A. Norton (eds.)]. The International Bank for Reconstruction and Development / The World Bank, Washington, DC, USA, pp. 47-74.",,,,,,,
426,"Roberts, J.T., 2011: Multipolarity and the new world (dis)order: US hegemonic decline and the fragmentation of the global climate regime. Global Environmental Change, 21(3), 776-784.",https://doi.org/10.1016/j.gloenvcha.2011.03.017,https://linkinghub.elsevier.com/retrieve/pii/S0959378011000446,10.1016/j.gloenvcha.2011.03.017,Publisher link; Analyzed abstract; Exported the abstract,0,0,0
427,"Robertson, B. and P. Pinstrup-Andersen, 2010: Global land acquisition: neo-colonialism or development opportunity? Food Security, 2(3), 271-283.",https://doi.org/10.1007/s12571-010-0068-1,https://link.springer.com/article/10.1007/s12571-010-0068-1,10.1007/s12571-010-0068-1,Publisher link; Analyzed abstract; Exported the abstract,0,0,0
428,"Rodima-Taylor, D., 2011: Social innovation and climate adaptation: local collective action in diversifying Tanzania. Applied Geography, 33, 128-134.",https://doi.org/10.1016/j.apgeog.2011.10.005,https://linkinghub.elsevier.com/retrieve/pii/S0143622811001822,10.1016/j.apgeog.2011.10.005,Publisher link; Analyzed abstract; Exported the abstract,0,6,0
429,"Röhr, U., 2006: Gender and climate change. Tiempo, 59, 3-7.",,,,,,,
430,"Rosset, P., 2011: Food sovereignty and alternative paradigms to confront land grabbing and the food and climate crises. Development, 54(1), 21-30.",https://doi.org/10.1057/dev.2010.102,https://link.springer.com/article/10.1057/dev.2010.102,10.1057/dev.2010.102,Publisher link,,,
431,"Ruel, M.T., J.L. Garrett, C. Hawkes, and M.J. Cohen, 2010: The food, fuel, and financial crises affect the urban and rural poor disproportionately: a review of the evidence. The Journal of Nutrition, 140(Suppl. 1), 170S-176S.",https://doi.org/10.3945/jn.109.110791,https://academic.oup.com/jn/article/140/1/170S/4743305,10.3945/jn.109.110791,Publisher link,,,
432,"Rulli, M.C., A. Saviori, and P. D'Odorico, 2013: Global land and water grabbing. Proceedings of the National Academy of Sciences of the United States of America, 110(3), 892-897.",https://doi.org/10.1073/pnas.1213163110,https://pnas.org/doi/full/10.1073/pnas.1213163110,10.1073/pnas.1213163110,Publisher link; Couldn't analyze abstract,,,
433,"Runge, C.F. and B. Senauer, 2007: How biofuels could starve the poor. Foreign Affairs, 86(3), www.foreignaffairs.com/articles/62609/c-ford-runge-and-benjamin- senauer/how-biofuels-could-starve-the-poor.",,,,,,,
434,"S. Lahmani, A. Oliver-Smith, and A. Pankhurst, 2011: Preparing for resettlement associated with climate change. Science, 334(6055), 456-457.",https://doi.org/10.1126/science.1208821,https://www.science.org/doi/10.1126/science.1208821,10.1126/science.1208821,Publisher link; Couldn't analyze abstract,,,
435,"Sabates-Wheeler, R., T. Mitchell, and F. Ellis, 2008: Avoiding repetition: time for CBA to engage with the livelihoods literature? IDS Bulletin, 39(4), 53-59.",https://doi.org/10.1111/j.1759-5436.2008.tb00476.x,https://onlinelibrary.wiley.com/resolve/doi?DOI=10.1111/j.1759-5436.2008.tb00476.x,10.1111/j.1759-5436.2008.tb00476.x,Publisher link; Couldn't analyze abstract,,,
436,"Sachs, J., 2006: The End of Poverty: Economic Possibilities for Our Time. Penguin Group, New York, NY, USA, 397 pp.",,,,,,,
437,"Saito, Y., 2009: Gender mainstreaming into community-based disaster management in the context of regional development. Regional Development Dialogue, 30(1), 37-46.",,,,,,,
438,"Salack, S., B. Muller, A.T. Gaye, F. Hourdin, and N. Cisse, 2012: Multi-scale analyses of dry spells across Niger and Senegal. Science et changements planétaires/ Sécheresse, 23(1), 3-13.",,,,,,,
439,"Sallu, S.M., C. Twyman, and L.C. Stringer, 2010: Resilient or vulnerable livelihoods? Assessing livelihood dynamics and trajectories in rural Botswana. Ecology and Society, 15(4), 3, www.ecologyandsociety.org/vol15/iss4/art3/.",https://doi.org/10.5751/ES-03505-150403,https://www.ecologyandsociety.org/vol15/iss4/art3/,10.5751/ES-03505-150403,Publisher link; Couldn't analyze abstract,,,
440,"Satterthwaite, D. and D. Mitlin, 2013: Reducing Urban Poverty in the Global South.",https://doi.org/10.4324/9780203104330,https://www.taylorfrancis.com/books/mono/10.4324/9780203104330/reducing-urban-poverty-global-south-david-satterthwaite-diana-mitlin,10.4324/9780203104330,Publisher link; Couldn't analyze abstract,,,
441,"Satterthwaite, D., 2011: How can urban centers adapt to climate change with ineffective or unrepresentative local governments? Wiley Interdisciplinary Reviews: Climate Change, 2(5), 767-776.",https://doi.org/10.1002/wcc.136,https://onlinelibrary.wiley.com/doi/10.1002/wcc.136,10.1002/wcc.136,Publisher link; Couldn't analyze abstract,,,
442,"Savaresi, A., 2013: REDD+ and human rights: addressing synergies between inter- national regimes. Ecology and Society, 18(3), 5, www.ecologyand society.org/vol18/iss3/art5/.",https://doi.org/10.5751/ES-05549-180305,https://www.ecologyandsociety.org/vol18/iss3/art5/,10.5751/ES-05549-180305,Publisher link; Couldn't analyze abstract,,,
443,"Schipper, E.L.F., 2007: Climate Change Adaptation and Development: Exploring the Linkages. Working Paper No. 107, Tyndall Centre for Climate Change Research, School of Environmental Sciences, University of East Anglia, and South East Asia START Regional Centre, Tyndall Centre for Climate Change Research, Norwich, UK, 13 pp.",,,,,,,
